A1: Name | B1: Gross | C1: Handicap | D1: Net | E1: Cum Gross | F1: Cum Net | G1: Award

A1: Date: 10/28/2000 Course: Entrada Slope: 123 Par: 72

A1: Bayles, Tim | B1: =C1+D1 -> 100 | C1: 20 | D1: 80 | E1: 294 | F1: 234 | G1: 2nd
A2: Buckley, Pat | B2: =C2+D2 -> 102 | C2: 20 | D2: 82 | E2: 302 | F2: 241
A3: Dah, Terry | B3: =C3+D3 -> 83 | C3: 10 | D3: 73 | E3: 253 | F3: 221 | G3: Champion
A4: Jameson, Tom | B4: =C4+D4 -> 97 | C4: 22 | D4: 75 | E4: 304 | F4: 242
A5: Langley, Bob | B5: =C5+D5 -> 109 | C5: 26 | D5: 83 | E5: DNF | F5: DNF
A6: Moore, Terry | B6: =C6+D6 -> 99 | C6: 24 | D6: 75 | E6: DNF | F6: DNF
A7: Phillips, Tom | B7: =C7+D7 -> 92 | C7: 18 | D7: 74 | E7: 285 | F7: 235 | G7: 3rd
A8: Smith, Lyn | B8: =C8+D8 -> 113 | C8: 32 | D8: 81 | E8: 382 | F8: 290
B10: Avg. Gross: | D10: =AVERAGE(B1:B8) -> 99.375
B11: Avg. Handicap: | D11: =AVERAGE(C1:C8) -> 21.5
B12: Avg. Net: | D12: =AVERAGE(D1:D8) -> 77.875

A1: Date: 10/27/2000 Course: Oasis Slope: 130 Par: 71

A1: Bayles, Tim | B1: 87 | C1: 22 | D1: 65 | E1: 194 | F1: 154
A2: Buckley, Pat | B2: 91 | C2: 21 | D2: 70 | E2: 200 | F2: 159
A3: Dah, Terry | B3: 80 | C3: 12 | D3: 68 | E3: 170 | F3: 148
A4: Jameson, Tom | B4: 95 | C4: 22 | D4: 73 | E4: 207 | F4: 167
A5: Langley, Bob | B5: 99 | C5: 27 | D5: 72 | E5: x | F5: x
A6: Moore, Terry | B6: 94 | C6: 24 | D6: 70 | E6: x | F6: x
A7: Phillips, Tom | B7: 87 | C7: 12 | D7: 69 | E7: 193 | F7: 161
A8: Smith, Lyn | B8: 129 | C8: 32 | D8: 97 | E8: 269 | F8: 209
B10: Avg. Gross: | D10: =AVERAGE(B1:B8) -> 95.25
B11: Avg. Handicap: | D11: =AVERAGE(C1:C8) -> 21.5
B12: Avg. Net: | D12: =AVERAGE(D1:D8) -> 73.0

A1: Date: 10/26/2000 Course: Rio Secco Slope: 138 Par: 72

A1: Bayles, Tim | B1: 107 | C1: 18 | D1: 89
A2: Buckley, Pat | B2: 109 | C2: 20 | D2: 89
A3: Dah, Terry | B3: 90 | C3: 10 | D3: 80
A4: Jameson, Tom | B4: 112 | C4: 18 | D4: 94
A5: Langley, Bob | B5: DNC | C5: 23 | D5: DNC
A6: Moore, Terry | B6: DNC | C6: 24 | D6: DNC
A7: Phillips, Tom | B7: 106 | C7: 14 | D7: 92
A8: Smith, Lyn | B8: 140 | C8: 28 | D8: 112
B10: Avg. Gross: | D10: =AVERAGE(B1:B8) -> 110.66666666666667
B11: Avg. Handicap: | D11: =AVERAGE(C1:C8) -> 19.375
B12: Avg. Net: | D12: =AVERAGE(D1:D8) -> 92.666666666666671