A1: Name | B1: Gross | C1: Handicap | D1: Net | E1: Stableford | F1: Cum Gross | G1: Cum Net | H1: Award

A2: Date: 10/29/2001 Course: Rio Secco Slope: 138 Par: 72

A1: Bainbridge, Buz | B1: 105 | C1: 17 | D1: 88 | E1: 22 | F1: 289 | G1: 240
A2: Bayles, Tim | B2: 97 | C2: 18 | D2: 79 | E2: 30 | F2: 276 | G2: 222
A3: Buckley, Pat | B3: 99 | C3: 17 | D3: 82 | E3: 26 | F3: 295 | G3: 245
A4: Carriere, Frank | B4: 100 | C4: 11 | D4: 89 | E4: 21 | F4: 276 | G4: 242
A5: Downey, Pat | B5: 87 | C5: 9 | D5: 78 | E5: 30 | F5: 256 | G5: 229
A6: Edwards, Dave | B6: 93 | C6: 13 | D6: 80 | E6: 30 | F6: 270 | G6: 232
A7: Fenton, Dave | B7: 90 | C7: 16 | D7: 74 | E7: 33 | F7: 271 | G7: 222 | H7: 3rd
A8: Graves, John | B8: 88 | C8: 13 | D8: 75 | E8: 35 | F8: 273 | G8: 238
A9: Hannigriff, Rich | B9: 93 | C9: 12 | D9: 81 | E9: 27 | F9: 272 | G9: 237
A10: Hertig, Steve | B10: 96 | C10: 13 | D10: 83 | E10: 26 | F10: 273 | G10: 238
A11: Jameson, Tom | B11: 107 | C11: 21 | D11: 86 | E11: 25 | F11: 299 | G11: 238
A12: Langley, Bob | B12: 95 | C12: 23 | D12: 72 | E12: 37 | F12: 288 | G12: 217 | H12: Champion
A13: Moore, Terry | B13: 99 | C13: 22 | D13: 77 | E13: 33 | F13: 284 | G13: 218 | H13: 2nd
A14: Noll, Jake | B14: 97 | C14: 20 | D14: 77 | E14: 32 | F14: 291 | G14: 238
A15: Phillips, Tom | B15: 95 | C15: 15 | D15: 80 | E15: 30 | F15: 282 | G15: 237
A16: Smith, Lyn | B16: 122 | C16: 28 | D16: 96 | E16: 15 | F16: 333 | G16: 249
A17: Strode, Bob | B17: 99 | C17: 18 | D17: 81 | E17: 30 | F17: 289 | G17: 235
A18: Yarbrough, Al | B18: 121 | C18: 34 | D18: 87 | E18: 21 | F18: 374 | G18: 276
C20: Avg. Gross: | E20: =AVERAGE(B1:B18) -> 99.055555555555557
C21: Avg. Handicap: | E21: =AVERAGE(C1:C18) -> 17.777777777777779
C22: Avg. Net: | E22: =AVERAGE(D1:D18) -> 81.388888888888886
C23: Avg. Stableford: | E23: =AVERAGE(E1:E18) -> 27.944444444444443

A1: Date: 10/28/2001 Course: Coral Canyon Slope: 135 Par: 72

A1: Bainbridge, Buz | B1: 93 | C1: 16 | D1: 77 | E1: 32 | F1: 184 | G1: 152
A2: Bayles, Tim | B2: 90 | C2: 18 | D2: 72 | E2: 37 | F2: 179 | G2: 143
A3: Buckley, Pat | B3: 101 | C3: 17 | D3: 84 | E3: 27 | F3: 196 | G3: 163
A4: Carriere, Frank | B4: 83 | C4: 13 | D4: 70 | E4: 35 | F4: 176 | G4: 153
A5: Downey, Pat | B5: 81 | C5: 10 | D5: 71 | E5: 38 | F5: 169 | G5: 151
A6: Edwards, Dave | B6: 87 | C6: 13 | D6: 74 | E6: 36 | F6: 177 | G6: 152
A7: Fenton, Dave | B7: 95 | C7: 17 | D7: 78 | E7: 29 | F7: 181 | G7: 148
A8: Graves, John | B8: 90 | C8: 13 | D8: 77 | E8: 32 | F8: 185 | G8: 163
A9: Hannigriff, Rich | B9: 86 | C9: 13 | D9: 73 | E9: 35 | F9: 179 | G9: 156
A10: Hertig, Steve | B10: 91 | C10: 11 | D10: 80 | E10: 30 | F10: 177 | G10: 155
A11: Jameson, Tom | B11: 99 | C11: 20 | D11: 79 | E11: 28 | F11: 192 | G11: 152
A12: Langley, Bob | B12: 90 | C12: 25 | D12: 65 | E12: 43 | F12: 193 | G12: 145
A13: Moore, Terry | B13: 89 | C13: 22 | D13: 67 | E13: 42 | F13: 185 | G13: 141
A14: Noll, Jake | B14: 101 | C14: 17 | D14: 84 | E14: 26 | F14: 194 | G14: 161
A15: Phillips, Tom | B15: 86 | C15: 16 | D15: 70 | E15: 39 | F15: 187 | G15: 157
A16: Smith, Lyn | B16: 100 | C16: 31 | D16: 69 | E16: 39 | F16: 211 | G16: 153
A17: Strode, Bob | B17: 87 | C17: 20 | D17: 67 | E17: 41 | F17: 190 | G17: 154
A18: Yarbrough, Al | B18: 126 | C18: 34 | D18: 92 | E18: 12 | F18: 253 | G18: 189
C20: Avg. Gross: | E20: =AVERAGE(B1:B18) -> 93.055555555555557
C21: Avg. Handicap: | E21: =AVERAGE(C1:C18) -> 18.111111111111111
C22: Avg. Net: | E22: =AVERAGE(D1:D18) -> 74.944444444444443
C23: Avg. Stableford: | E23: =AVERAGE(E1:E18) -> 33.388888888888886

A1: Date: 10/27/2001 Course: Wolf Creek Slope: 138 Par: 72

A1: Bainbridge, Buz | B1: 91 | C1: 16 | D1: 75 | E1: 33
A2: Bayles, Tim | B2: 89 | C2: 18 | D2: 71 | E2: 36
A3: Buckley, Pat | B3: 95 | C3: 16 | D3: 79 | E3: 29
A4: Carriere, Frank | B4: 93 | C4: 10 | D4: 83 | E4: 28
A5: Downey, Pat | B5: 88 | C5: 8 | D5: 80 | E5: 28
A6: Edwards, Dave | B6: 90 | C6: 12 | D6: 78 | E6: 30
A7: Fenton, Dave | B7: 86 | C7: 16 | D7: 70 | E7: 39
A8: Graves, John | B8: 95 | C8: 9 | D8: 86 | E8: 25
A9: Hannigriff, Rich | B9: 93 | C9: 10 | D9: 83 | E9: 26
A10: Hertig, Steve | B10: 86 | C10: 11 | D10: 75 | E10: 33
A11: Jameson, Tom | B11: 93 | C11: 20 | D11: 73 | E11: 35
A12: Langley, Bob | B12: 103 | C12: 23 | D12: 80 | E12: 28
A13: Moore, Terry | B13: 96 | C13: 22 | D13: 74 | E13: 34
A14: Noll, Jake | B14: 93 | C14: 16 | D14: 77 | E14: 32
A15: Phillips, Tom | B15: 101 | C15: 14 | D15: 87 | E15: 24
A16: Smith, Lyn | B16: 111 | C16: 27 | D16: 84 | E16: 25
A17: Strode, Bob | B17: 103 | C17: 16 | D17: 87 | E17: 24
A18: Yarbrough, Al | B18: 127 | C18: 30 | D18: 97 | E18: 16
C20: Avg. Gross: | E20: =AVERAGE(B1:B18) -> 96.277777777777771
C21: Avg. Handicap: | E21: =AVERAGE(C1:C18) -> 16.333333333333332
C22: Avg. Net: | E22: =AVERAGE(D1:D18) -> 79.944444444444443
C23: Avg. Stableford: | E23: =AVERAGE(E1:E18) -> 29.166666666666668