A1: 2004 Final Standings
A2: Player Name | B2: NET TOTAL | C2: GROSS TOTAL
A3: Fenton | B3: 207.92920353982302 | C3: 249
A4: Parsley | B4: 210.66017699115045 | C4: 241
A5: Langley | B5: 211.6283185840708 | C5: 295
A6: Morey | B6: 216.23893805309734 | C6: 262
A7: Bayles | B7: 216.58407079646017 | C7: 281
A8: Larson | B8: 218.48672566371681 | C8: 323
A9: Moore | B9: 221.28318584070797 | C9: 286
A10: Hanagriff | B10: 222.35398230088495 | C10: 253
A11: Elliott | B11: 227.64601769911505 | C11: 246
A12: Graves Jerry | B12: 231.15929203539824 | C12: 278
A13: Stiles | B13: 231.89380530973452 | C13: 261
A14: Carriere | B14: 232.64601769911505 | C14: 255
A15: Kucharski | B15: 232.77876106194688 | C15: 293
A16: Hart | B16: 234.49557522123894 | C16: 306
A17: Phillips | B17: 236.69026548672565 | C17: 282
A18: Smith | B18: 237.57522123893807 | C18: 338
A19: Graves John | B19: 237.69026548672565 | C19: 281
A20: Fancler | B20: 242.48672566371681 | C20: 349
A21: Anderson | B21: 243.87610619469024 | C21: 314
A22: Swauger | B22: 253.5840707964602 | C22: 342
A23: Wheatley | B23: 254.6283185840708 | C23: 332
A24: Yarbrough | B24: 256.33628318584067 | C24: 364
A25: Black | B25: 263.07964601769913 | C25: 337
A26: Coffey | B26: 269.09734513274338 | C26: 362

A1: Players
A2: Player Name | B2: status | C2: 2002 Hdcp | D2: 2003 hdcp | E2: 2004 Indx
A3: Bayles | B3: returning | C3: 15.6 | D3: 17.9 | E3: 18
A4: Yarbrough | B4: returning | D4: 24 | E4: 31
A5: Graves John | B5: returning | C5: 8.1 | D5: 13.5 | E5: 11
A6: Fenton | B6: returning | C6: 15.6 | D6: 13.5 | E6: 12.2
A7: Morey | B7: returning | C7: 20.5 | D7: 15.5 | E7: 12.5
A8: Hart | B8: rookie | E8: 18.4
A9: Elliott (defending) | B9: returning | C9: 6.1 | D9: 7 | E9: 4.5
A10: Fancler | B10: returning | D10: 25 | E10: 30
A11: Larson | B11: returning | D11: 22 | E11: 30
A12: Hanagriff | B12: returning | C12: 8.1 | D12: 7.9 | E12: 6.8
A13: Moore | B13: returning | C13: 19.2 | D13: 16.9 | E13: 19
A14: Smith | B14: returning | C14: 30.6 | D14: 28 | E14: 28
A15: Wheatley | B15: returning | D15: 20.4 | E15: 20.1
A16: Stiles | B16: returning | D16: 6 | E16: 7
A17: Coffey | B17: returning | D17: 28 | E17: 24.6
A18: Anderson | B18: rookie | E18: 18
A19: Graves Jerry | B19: rookie | E19: 12.1
A20: Black | B20: rookie | E20: 19.1
A21: Carriere | B21: former player | E21: 4.5
A22: Kucharski | B22: rookie | E22: 16
A23: Phillips | B23: former player | E23: 11
A24: Swauger | B24: former player | C24: 26.4 | E24: 23.3
A25: Langley | B25: former player | E25: 24.5
A26: Parsley | B26: former player | E26: 8.84

A1: Entrada
A2: Player Name | B2: Hdcp | C2: Gross | D2: Net | E2: Orig hdcp
A3: Bayles | B3: 20.707964601769913 | C3: 102 | D3: =C3-B3 -> 81.292035398230084 | E3: =B3 -> 20.707964601769913
A4: Yarbrough | B4: 35.663716814159294 | C4: 123 | D4: =C4-B4 -> 87.336283185840699 | E4: =B4 -> 35.663716814159294
A5: Graves John | B5: 12.654867256637168 | C5: 98 | D5: =C5-B5 -> 85.345132743362825 | E5: =B5 -> 12.654867256637168
A6: Fenton | B6: 14.035398230088495 | C6: 85 | D6: =C6-B6 -> 70.964601769911511 | E6: =B6 -> 14.035398230088495
A7: Morey | B7: 14.380530973451327 | C7: 103 | D7: =C7-B7 -> 88.619469026548671 | E7: =B7 -> 14.380530973451327
A8: Hart | B8: 21.168141592920353 | C8: 116 | D8: =C8-B8 -> 94.83185840707965 | E8: =B8 -> 21.168141592920353
A9: Elliott (defending) | B9: 5.1769911504424782 | C9: 87 | D9: =C9-B9 -> 81.823008849557525 | E9: =B9 -> 5.1769911504424782
A10: Fancler | B10: 34.513274336283189 | C10: 128 | D10: =C10-B10 -> 93.486725663716811 | E10: =B10 -> 34.513274336283189
A11: Larson | B11: 34.513274336283189 | C11: 117 | D11: =C11-B11 -> 82.486725663716811 | E11: =B11 -> 34.513274336283189
A12: Hanagriff | B12: 7.8230088495575218 | C12: 93 | D12: =C12-B12 -> 85.176991150442475 | E12: =B12 -> 7.8230088495575218
A13: Moore | B13: 21.858407079646017 | C13: 97 | D13: =C13-B13 -> 75.141592920353986 | E13: =B13 -> 21.858407079646017
A14: Smith | B14: 32.212389380530972 | C14: 123 | D14: =C14-B14 -> 90.787610619469035 | E14: =B14 -> 32.212389380530972
A15: Wheatley | B15: 23.123893805309734 | C15: 109 | D15: =C15-B15 -> 85.876106194690266 | E15: =B15 -> 23.123893805309734
A16: Stiles | B16: 8.053097345132743 | C16: 86 | D16: =C16-B16 -> 77.946902654867259 | E16: =B16 -> 8.053097345132743
A17: Coffey | B17: 28.300884955752213 | C17: 130 | D17: =C17-B17 -> 101.69911504424779 | E17: =B17 -> 28.300884955752213
A18: Anderson | B18: 20.707964601769913 | C18: 112 | D18: =C18-B18 -> 91.292035398230084 | E18: =B18 -> 20.707964601769913
A19: Graves Jerry | B19: 13.920353982300885 | C19: 94 | D19: =C19-B19 -> 80.079646017699119 | E19: =B19 -> 13.920353982300885
A20: Black | B20: 21.973451327433629 | C20: 121 | D20: =C20-B20 -> 99.026548672566378 | E20: =B20 -> 21.973451327433629
A21: Carriere | B21: 5.1769911504424782 | C21: 88 | D21: =C21-B21 -> 82.823008849557525 | E21: =B21 -> 5.1769911504424782
A22: Kucharski | B22: 18.407079646017699 | C22: 99 | D22: =C22-B22 -> 80.592920353982294 | E22: =B22 -> 18.407079646017699
A23: Phillips | B23: 12.654867256637168 | C23: 101 | D23: =C23-B23 -> 88.345132743362825 | E23: =B23 -> 12.654867256637168
A24: Swauger | B24: 26.805309734513273 | C24: 114 | D24: =C24-B24 -> 87.194690265486727 | E24: =B24 -> 26.805309734513273
A25: Langley | B25: 28.185840707964601 | C25: 106 | D25: =C25-B25 -> 77.814159292035399 | E25: =B25 -> 28.185840707964601
A26: Parsley | B26: 10.169911504424778 | C26: 88 | D26: =C26-B26 -> 77.830088495575225 | E26: =B26 -> 10.169911504424778
B27: Avg: | C27: =SUM(C3:C26)/24 -> 105 | D27: =SUM(D3:D26)/24 -> 85.325516224188789

A1: Wolf Creek
A2: Player Name | B2: Day 1 Adjust | C2: Hdcp | D2: Gross | E2: Net | F2: 1+2 total gross | G2: 1+2 total net
A3: Bayles | B3: 2 | C3: 22.707964601769913 | D3: 95 | E3: =D3-C3 -> 72.292035398230084 | F3: 197 | G3: 153.58407079646017
A4: Yarbrough | B4: 4 | C4: 36 | D4: 119 | E4: =D4-C4 -> 83 | F4: 242 | G4: 170.3362831858407
A5: Graves John | B5: 3 | C5: 15.654867256637168 | D5: 89 | E5: =D5-C5 -> 73.345132743362825 | F5: 187 | G5: 158.69026548672565
A6: Fenton | B6: 0 | C6: 14.035398230088495 | D6: 83 | E6: =D6-C6 -> 68.964601769911511 | F6: 168 | G6: 139.92920353982302
A7: Morey | B7: 4 | C7: 18.380530973451329 | D7: 78 | E7: =D7-C7 -> 59.619469026548671 | F7: 181 | G7: 148.23893805309734
A8: Hart | B8: 4 | C8: 25.168141592920353 | D8: 96 | E8: =D8-C8 -> 70.83185840707965 | F8: 212 | G8: 165.6637168141593
A9: Elliott (defending) | B9: 2 | C9: 7.1769911504424782 | D9: 79 | E9: =D9-C9 -> 71.823008849557525 | F9: 166 | G9: 153.64601769911505
A10: Fancler | B10: 4 | C10: 36 | D10: 116 | E10: =D10-C10 -> 80 | F10: 244 | G10: 173.48672566371681
A11: Larson | B11: 2 | C11: 36 | D11: 105 | E11: =D11-C11 -> 69 | F11: 222 | G11: 151.48672566371681
A12: Hanagriff | B12: 3 | C12: 10.823008849557521 | D12: 79 | E12: =D12-C12 -> 68.176991150442475 | F12: 172 | G12: 153.35398230088495
A13: Moore | B13: 0 | C13: 21.858407079646017 | D13: 96 | E13: =D13-C13 -> 74.141592920353986 | F13: 193 | G13: 149.28318584070797
A14: Smith | B14: 4 | C14: 36.212389380530972 | D14: 98 | E14: =D14-C14 -> 61.787610619469028 | F14: 221 | G14: 152.57522123893807
A15: Wheatley | B15: 4 | C15: 27.123893805309734 | D15: 117 | E15: =D15-C15 -> 89.876106194690266 | F15: 226 | G15: 175.75221238938053
A16: Stiles | B16: 1 | C16: 9.053097345132743 | D16: 92 | E16: =D16-C16 -> 82.946902654867259 | F16: 178 | G16: 160.89380530973452
A17: Coffey | B17: 4 | C17: 32.30088495575221 | D17: 108 | E17: =D17-C17 -> 75.69911504424779 | F17: 238 | G17: 177.39823008849558
A18: Anderson | B18: 4 | C18: 24.707964601769913 | D18: 106 | E18: =D18-C18 -> 81.292035398230084 | F18: 218 | G18: 172.58407079646017
A19: Graves Jerry | B19: 2 | C19: 15.920353982300885 | D19: 97 | E19: =D19-C19 -> 81.079646017699119 | F19: 191 | G19: 161.15929203539824
A20: Black | B20: 4 | C20: 25.973451327433629 | D20: 114 | E20: =D20-C20 -> 88.026548672566378 | F20: 235 | G20: 187.05309734513276
A21: Carriere | B21: 3 | C21: 8.176991150442479 | D21: 86 | E21: =D21-C21 -> 77.823008849557525 | F21: 174 | G21: 160.64601769911505
A22: Kucharski | B22: 2 | C22: 20.407079646017699 | D22: 99 | E22: =D22-C22 -> 78.592920353982294 | F22: 198 | G22: 159.18584070796459
A23: Phillips | B23: 4 | C23: 16.654867256637168 | D23: 91 | E23: =D23-C23 -> 74.345132743362825 | F23: 192 | G23: 162.69026548672565
A24: Swauger | B24: 4 | C24: 30.805309734513273 | D24: 117 | E24: =D24-C24 -> 86.194690265486727 | F24: 231 | G24: 173.38938053097345
A25: Langley | B25: 1 | C25: 29.185840707964601 | D25: 92 | E25: =D25-C25 -> 62.814159292035399 | F25: 198 | G25: 140.6283185840708
A26: Parsley | B26: 1 | C26: 11.169911504424778 | D26: 75 | E26: =D26-C26 -> 63.830088495575225 | F26: 163 | G26: 141.66017699115045
C27: Avg: | D27: =SUM(D3:D26)/24 -> 96.958333333333329 | E27: =SUM(E3:E26)/24 -> 74.812610619469027

A1: RedRock
A2: Player Name | B2: Day 2 Adjust | C2: Hdcp | D2: Gross | E2: Net (1) | F2: NET TOTAL | G2: GROSS TOTAL | H2: Player Name
A3: Bayles | B3: 2 | C3: 22.707964601769913 | D3: 84 | E3: 63 | F3: 216.58407079646017 | G3: 281 | H3: Bayles
A4: Yarbrough | B4: 4 | C4: 36 | D4: 122 | E4: =D4-C4 -> 86 | F4: 256.33628318584067 | G4: 364 | H4: Yarbrough
A5: Graves John | B5: 3 | C5: 15.654867256637168 | D5: 94 | E5: 79 | F5: 237.69026548672565 | G5: 281 | H5: Graves John
A6: Fenton | B6: 0 | C6: 14.035398230088495 | D6: 81 | E6: 68 | F6: 207.92920353982302 | G6: 249 | H6: Fenton
A7: Morey | B7: 0 | C7: 14.380530973451327 | D7: 81 | E7: 68 | F7: 216.23893805309734 | G7: 262 | H7: Morey
A8: Hart | B8: 4 | C8: 25.168141592920353 | D8: 94 | E8: =D8-C8 -> 68.83185840707965 | F8: 234.49557522123894 | G8: 306 | H8: Hart
A9: Elliott (defending) | B9: 2 | C9: 7.1769911504424782 | D9: 80 | E9: 74 | F9: 227.64601769911505 | G9: 246 | H9: Elliott
A10: Fancler | B10: 4 | C10: 36 | D10: 105 | E10: =D10-C10 -> 69 | F10: 242.48672566371681 | G10: 349 | H10: Fancler
A11: Larson | B11: 1 | C11: 35.513274336283189 | D11: 101 | E11: 67 | F11: 218.48672566371681 | G11: 323 | H11: Larson
A12: Hanagriff | B12: 1 | C12: 8.823008849557521 | D12: 81 | E12: 69 | F12: 222.35398230088495 | G12: 253 | H12: Hanagriff
A13: Moore | B13: 0 | C13: 21.858407079646017 | D13: 93 | E13: 72 | F13: 221.28318584070797 | G13: 286 | H13: Moore
A14: Smith | B14: 1 | C14: 33.212389380530972 | D14: 117 | E14: 85 | F14: 237.57522123893807 | G14: 338 | H14: Smith
A15: Wheatley | B15: 4 | C15: 27.123893805309734 | D15: 106 | E15: =D15-C15 -> 78.876106194690266 | F15: 254.6283185840708 | G15: 332 | H15: Wheatley
A16: Stiles | B16: 4 | C16: 12.053097345132743 | D16: 83 | E16: 71 | F16: 231.89380530973452 | G16: 261 | H16: Stiles
A17: Coffey | B17: 4 | C17: 32.30088495575221 | D17: 124 | E17: =D17-C17 -> 91.69911504424779 | F17: 269.09734513274338 | G17: 362 | H17: Coffey
A18: Anderson | B18: 4 | C18: 24.707964601769913 | D18: 96 | E18: =D18-C18 -> 71.292035398230084 | F18: 243.87610619469024 | G18: 314 | H18: Anderson
A19: Graves Jerry | B19: 4 | C19: 17.920353982300885 | D19: 87 | E19: 70 | F19: 231.15929203539824 | G19: 278 | H19: Graves Jerry
A20: Black | B20: 4 | C20: 25.973451327433629 | D20: 102 | E20: =D20-C20 -> 76.026548672566378 | F20: 263.07964601769913 | G20: 337 | H20: Black
A21: Carriere | B21: 4 | C21: 9.176991150442479 | D21: 81 | E21: 72 | F21: 232.64601769911505 | G21: 255 | H21: Carriere
A22: Kucharski | B22: 3 | C22: 21.407079646017699 | D22: 95 | E22: =D22-C22 -> 73.592920353982294 | F22: 232.77876106194688 | G22: 293 | H22: Kucharski
A23: Phillips | B23: 4 | C23: 16.654867256637168 | D23: 90 | E23: 74 | F23: 236.69026548672565 | G23: 282 | H23: Phillips
A24: Swauger | B24: 4 | C24: 30.805309734513273 | D24: 111 | E24: =D24-C24 -> 80.194690265486727 | F24: 253.5840707964602 | G24: 342 | H24: Swauger
A25: Langley | B25: 0 | C25: 28.185840707964601 | D25: 97 | E25: 71 | F25: 211.6283185840708 | G25: 295 | H25: Langley
A26: Parsley | B26: 0 | C26: 10.169911504424778 | D26: 78 | E26: 69 | F26: 210.66017699115045 | G26: 241 | H26: Parsley
C27: Avg: | D27: =SUM(D3:D26)/24 -> 95.125 | E27: =SUM(E3:E26)/24 -> 73.646386430678461