A1: Name | B1: Gross | C1: Handicap | D1: Net | E1: Skins | F1: Cum Gross | G1: Cum Net | H1: Award

A1: Date: 10/12/2002 Course: Casa Blanca Slope: 126 Par: 72

A1: Anderson, Bob | B1: 112 | C1: =B1-D1 -> 24 | D1: 88 | F1: 333 | G1: 261
A2: Bayles, Tim | B2: 98 | C2: =B2-D2 -> 16 | D2: 82 | F2: 281 | G2: 230
A3: Carriere, Frank | B3: 81 | C3: =B3-D3 -> 11 | D3: 70 | E3: 2 | F3: 261 | G3: 229
A4: Elliott, Ed | B4: 86 | C4: =B4-D4 -> 5 | D4: 81 | F4: 237 | G4: 219 | H4: Champion - Gross
A5: Fenton, Dave | B5: 89 | C5: =B5-D5 -> 16 | D5: 73 | F5: 262 | G5: 214 | H5: 2nd
A6: Graves, John | B6: 95 | C6: =B6-D6 -> 12 | D6: 83 | E6: 1 | F6: 283 | G6: 250
A7: Hannigriff, Rich | B7: 77 | C7: =B7-D7 -> 8 | D7: 69 | E7: 1 | F7: 241 | G7: 214 | H7: Champion - Net
A8: Langley, Bob | B8: 101 | C8: =B8-D8 -> 23 | D8: 78 | E8: 1 | F8: 300 | G8: 230
A9: Moore, Terry | B9: 95 | C9: =B9-D9 -> 19 | D9: 76 | F9: 285 | G9: 223
A10: Morey, Dave | B10: 90 | C10: =B10-D10 -> 22 | D10: 68 | E10: 1 | F10: 286 | G10: 219 | H10: 3rd
A11: Smith, Lyn | B11: 105 | C11: =B11-D11 -> 35 | D11: 70 | E11: 2 | F11: 340 | G11: 235
A12: Swauger, David | B12: 108 | C12: =B12-D12 -> 30 | D12: 78 | E12: 3 | F12: 338 | G12: 247
B14: Avg. Gross: | D14: =AVERAGE(B1:B12) -> 94.75
B15: Avg. Handicap: | D15: =AVERAGE(C1:C12) -> 18.416666666666668
B16: Avg. Net: | D16: =AVERAGE(D1:D12) -> 76.333333333333329

A1: Date: 10/11/2002 Course: Coral Canyon Slope: 135 Par: 72

A1: Anderson, Bob | B1: 109 | C1: 24 | D1: 85 | F1: 221 | G1: 173
A2: Bayles, Tim | B2: 86 | C2: 17 | D2: 69 | F2: 183 | G2: 148
A3: Carriere, Frank | B3: 86 | C3: 11 | D3: 75 | F3: 180 | G3: 159
A4: Elliott, Ed | B4: 75 | C4: 6 | D4: 69 | F4: 151 | G4: 138
A5: Fenton, Dave | B5: 90 | C5: 14 | D5: 76 | F5: 173 | G5: 141
A6: Graves, John | B6: 93 | C6: 11 | D6: 82 | F6: 188 | G6: 167
A7: Hannigriff, Rich | B7: 77 | C7: 9 | D7: 68 | F7: 164 | G7: 145
A8: Langley, Bob | B8: 98 | C8: 22 | D8: 76 | E8: 1 | F8: 199 | G8: 152
A9: Moore, Terry | B9: 88 | C9: 20 | D9: 68 | F9: 190 | G9: 147
A10: Morey, Dave | B10: 97 | C10: 21 | D10: 76 | E10: 2 | F10: 196 | G10: 151
A11: Smith, Lyn | B11: 113 | C11: 34 | D11: 79 | E11: 1 | F11: 235 | G11: 165
A12: Swauger, David | B12: 110 | C12: 30 | D12: 80 | E12: 1 | F12: 230 | G12: 169
B14: Avg. Gross: | D14: =AVERAGE(B1:B12) -> 93.5
B15: Avg. Handicap: | D15: =AVERAGE(C1:C12) -> 18.25
B16: Avg. Net: | D16: =AVERAGE(D1:D12) -> 75.25

A1: Date: 10/10/2002 Course: Wolf Creek Slope: 138 Par: 72

A1: Anderson, Bob | B1: 112 | C1: 24 | D1: 88
A2: Bayles, Tim | B2: 97 | C2: 18 | D2: 79 | E2: 1
A3: Carriere, Frank | B3: 94 | C3: 10 | D3: 84
A4: Elliott, Ed | B4: 76 | C4: 7 | D4: 69
A5: Fenton, Dave | B5: 83 | C5: 18 | D5: 65 | E5: 1
A6: Graves, John | B6: 95 | C6: 10 | D6: 85
A7: Hannigriff, Rich | B7: 87 | C7: 10 | D7: 77
A8: Langley, Bob | B8: 101 | C8: 25 | D8: 76 | E8: 1
A9: Moore, Terry | B9: 102 | C9: 23 | D9: 79
A10: Morey, Dave | B10: 99 | C10: 24 | D10: 75 | E10: 1
A11: Smith, Lyn | B11: 122 | C11: 36 | D11: 86
A12: Swauger, David | B12: 120 | C12: 31 | D12: 89
B14: Avg. Gross: | D14: =AVERAGE(B1:B12) -> 99.0
B15: Avg. Handicap: | D15: =AVERAGE(C1:C12) -> 19.666666666666668
B16: Avg. Net: | D16: =AVERAGE(D1:D12) -> 79.333333333333329 | G16: \